{
  "schema_version": "engine-reference-fixture.v1",
  "id": "example-public-natal-pending",
  "status": "pending_reference",
  "calculation": "natal",
  "input": {
    "year": 2000,
    "month": 1,
    "day": 1,
    "hour": 12.0,
    "timezone": "UTC",
    "utc_offset_minutes": 0,
    "lat": 0.0,
    "lon": 0.0,
    "house_system": "Regiomontanus"
  },
  "reference": {
    "pending_reason": "No authoritative external export has been captured and approved yet. This fixture must not certify the engine."
  },
  "tolerances": {
    "degree": 0.01,
    "house": 0.01,
    "orb": 0.01
  }
}
